{"$schema":"https://json-schema.org/draft/2020-12/schema","type":"object","required":["package","version","artifact","registry_hashes","source","observed_at"],"properties":{"package":{"type":"object"},"version":{"type":"object","required":["raw_version"],"properties":{"raw_version":{"type":"string"},"normalized_version":{"type":"string"},"normalization_status":{"type":"string"}}},"artifact":{"type":"object"},"registry_hashes":{"type":"object","minProperties":1,"properties":{"sha256":{"type":"string","pattern":"^[a-f0-9]{64}$"},"sha512":{"type":"string","pattern":"^[a-f0-9]{128}$"}}},"local_hashes":{"type":"object"},"storage_ref":{"type":"string"},"source":{"type":"string"},"observed_at":{"type":"string","format":"date-time"}}}
