{"package":{"ecosystem":"npm","normalized_name":"left-pad"},"version":{"raw_version":"1.0.0"},"artifact":{"kind":"npm_tgz","filename":"left-pad-1.0.0.tgz"},"registry_hashes":{"sha256":"aaaaaaaaaaaaaaaaaaaaaaaaaaaaaaaaaaaaaaaaaaaaaaaaaaaaaaaaaaaaaaaa"},"source":"npm","observed_at":"2026-05-24T00:00:00Z"}
